{"catalog_schema":1,"catalog_version":"2026.07.24","deltas":[],"full":{"download_bytes":73400320,"installed_bytes":188743680,"name":"catalog-full-2026.07.24.sqlite.zip","sha256":"aaaaaaaaaaaaaaaaaaaaaaaaaaaaaaaaaaaaaaaaaaaaaaaaaaaaaaaaaaaaaaaa"},"manifest_schema":1,"minimum_app_version":"2.0.0-beta.10","published_at":"2026-07-24T12:00:00Z"}
